{
  "id": "catholic-intellectual-history",
  "version": "1.0",
  "label": {"fr": "Histoire intellectuelle catholique", "en": "Catholic intellectual history"},
  "rootType": "human",
  "facets": [
    {"relation": "lifespan", "widget": "range"},
    {"relation": "field_of_work", "widget": "entity-picker"},
    {"relation": "religious_tradition", "widget": "entity-picker"},
    {"relation": "religious_order", "widget": "entity-picker"},
    {"relation": "movement", "widget": "entity-picker"},
    {"relation": "educated_at", "widget": "entity-picker"},
    {"relation": "influenced_by", "widget": "entity-picker"},
    {"relation": "authored_work", "widget": "entity-picker"}
  ]
}
