{
  "id": "sociodemography",
  "version": "1.0",
  "label": {"fr": "Sociodémographie", "en": "Sociodemography"},
  "rootType": "human",
  "facets": [
    {"relation": "lifespan", "widget": "range"},
    {"relation": "birth_place", "widget": "entity-picker"},
    {"relation": "citizenship", "widget": "entity-picker"},
    {"relation": "gender", "widget": "entity-picker"},
    {"relation": "occupation", "widget": "multi-select"},
    {"relation": "educated_at", "widget": "entity-picker"}
  ]
}
